{
  "schema": 2,
  "launch_places": [
    {
      "name": "Собрать маршрут согласования",
      "scenario": "Собрать маршрут согласования",
      "extraction_map": "Собрать маршрут согласования",
      "place_type": "Глобально",
      "command_title": "Собрать маршрут согласования",
      "description": "Маршрут согласования собирается в разговоре и записывается новым шаблоном.",
      "initial_prompt": "Собери маршрут согласования со слов пользователя.",
      "action_kind": "СоздатьОбъект",
      "action_title": "Создать шаблон",
      "dialog_mode": true,
      "visibility": [
        { "kind": "Роль", "name": "ПолныеПрава" },
        { "kind": "ГруппаДоступа", "name": "Делопроизводители" }
      ]
    }
  ],
  "extraction_maps": [
    {
      "name": "Собрать маршрут согласования",
      "metadata_name": "Справочник.ШаблоныСогласования",
      "fields": [
        { "attribute_path": "Наименование" },
        { "attribute_path": "ВариантСогласования", "choose_from_list": true },
        {
          "tabular_section": "Исполнители",
          "attribute_path": "Исполнитель",
          "reference_type": "Справочник.Пользователи, Справочник.ПолныеРоли",
          "choose_from_list": true
        },
        {
          "tabular_section": "Исполнители",
          "attribute_path": "ПорядокСогласования",
          "choose_from_list": true,
          "hint": "Порядок — относительно предыдущей строки: «После предыдущего» — следующий этап, «Вместе с предыдущим» — тот же этап, что у предыдущей строки. Пример: «сначала А, потом одновременно Б и В, затем Г» — А: После предыдущего; Б: После предыдущего; В: Вместе с предыдущим; Г: После предыдущего."
        },
        { "tabular_section": "Исполнители", "attribute_path": "СрокИсполненияДни" },
        {
          "tabular_section": "Исполнители",
          "attribute_path": "ВариантУстановкиСрокаИсполнения",
          "choose_from_list": true,
          "hint": "Срок в днях или часах — «Относительный срок», конкретная дата — «Точный срок»."
        }
      ]
    }
  ],
  "scenarios": [
    { "name": "Собрать маршрут согласования", "max_attempts": 2 }
  ]
}
